{
  "version": 2,
  "revision": 1,
  "metadata": {
    "name": "cluster-demo",
    "tenant": "acme"
  },
  "resolution": {
    "platform_profile": {
      "id": "local-backend",
      "revision": 1,
      "digest": "7bd9d983f34d1225d004970fddcf5ae49a476c94161c46c1dbe847b7834190ce"
    },
    "application_composition": {
      "id": "cluster-demo",
      "revision": 2,
      "digest": "a9ae28fd541872df80381db8047b120460ac63268862020a306cec5b5bf6a3f9"
    },
    "development_mode": true,
    "plugin_origins": {
      "cn.vastplan.example.backend.permission": "platform-profile",
      "cn.vastplan.example.backend.hello-world": "application"
    },
    "plugin_baselines": {
      "cn.vastplan.example.backend.permission": "application-permission-demo"
    }
  },
  "units": [
    {
      "id": "backend-main",
      "kind": "service",
      "enabled": true,
      "service_role": "backend",
      "logical_service": "cluster-demo.hello",
      "instance_policy": "active-active",
      "state_model": "external-shared",
      "visibility": "cluster",
      "routing": "queue",
      "routing_domain": "application",
      "replicas": 2,
      "placement": {
        "nodeSelector": {
          "region": "cn"
        }
      },
      "plugins": [
        {
          "id": "cn.vastplan.example.backend.permission",
          "version": "0.1.2",
          "channel": "stable",
          "sha256": "aaaaaaaaaaaaaaaaaaaaaaaaaaaaaaaaaaaaaaaaaaaaaaaaaaaaaaaaaaaaaaaa"
        },
        {
          "id": "cn.vastplan.example.backend.hello-world",
          "version": "0.2.2",
          "channel": "stable",
          "sha256": "aaaaaaaaaaaaaaaaaaaaaaaaaaaaaaaaaaaaaaaaaaaaaaaaaaaaaaaaaaaaaaaa"
        }
      ],
      "config": {
        "kernel_service_grants": {
          "cn.vastplan.example.backend.hello-world": ["kernel.info"]
        },
        "plugins": {
          "cn.vastplan.example.backend.hello-world": {
            "greetingTemplate": "你好，{{name}}！我是 VastPlan 租户级插件。"
          }
        }
      }
    }
  ]
}
