{
  "version": 2,
  "revision": 1,
  "metadata": {
    "name": "cluster-demo",
    "tenant": "acme"
  },
  "resolution": {
    "platform_profile": {
      "id": "local-backend",
      "revision": 1,
      "digest": "e7b83d8ca2beff6a33637bdfb3bc02806c28613e4aea2a569569b62d7f1938ed"
    },
    "application_composition": {
      "id": "cluster-demo",
      "revision": 2,
      "digest": "48f4d2ffad56200a86439e6b5ea24abbd763974902d9e585471110be9364f21c"
    },
    "development_mode": true,
    "plugin_origins": {
      "cn.vastplan.demo-permission": "platform-profile",
      "cn.vastplan.hello-world": "application"
    },
    "plugin_baselines": {
      "cn.vastplan.demo-permission": "application-permission-demo"
    }
  },
  "units": [
    {
      "id": "backend-main",
      "kind": "service",
      "enabled": true,
      "service_role": "backend",
      "logical_service": "cluster-demo.hello",
      "instance_policy": "active-active",
      "state_model": "external-shared",
      "visibility": "cluster",
      "routing": "queue",
      "routing_domain": "application",
      "replicas": 2,
      "placement": {
        "nodeSelector": {
          "region": "cn"
        }
      },
      "plugins": [
        {
          "id": "cn.vastplan.demo-permission",
          "version": "0.1.1",
          "channel": "stable"
        },
        {
          "id": "cn.vastplan.hello-world",
          "version": "0.2.1",
          "channel": "stable"
        }
      ],
      "config": {
        "plugins": {
          "cn.vastplan.hello-world": {
            "greetingTemplate": "你好，{{name}}！我是 VastPlan 租户级插件。"
          }
        }
      }
    }
  ]
}
