{
  "version": 2,
  "revision": 1,
  "metadata": {
    "name": "cluster-demo",
    "tenant": "acme"
  },
  "resolution": {
    "platform_profile": {
      "id": "local-backend",
      "revision": 1,
      "digest": "1aafe7510bf136d0a6c26f4064463f98e270bd60eba419495ab54bb13543e36e"
    },
    "application_composition": {
      "id": "cluster-demo",
      "revision": 1,
      "digest": "d280a808938ba21f71423d28618e7d6d5a8174a8a70de5edfa53498f7003bb88"
    },
    "development_mode": true,
    "plugin_origins": {
      "com.vastplan.demo-permission": "platform-profile",
      "com.vastplan.hello-world": "application"
    }
  },
  "units": [
    {
      "id": "backend-main",
      "kind": "service",
      "enabled": true,
      "service_role": "backend",
      "replicas": 2,
      "placement": {
        "nodeSelector": {
          "region": "cn"
        }
      },
      "plugins": [
        {
          "id": "com.vastplan.demo-permission",
          "version": "0.1.0",
          "channel": "stable"
        },
        {
          "id": "com.vastplan.hello-world",
          "version": "0.1.0",
          "channel": "stable"
        }
      ]
    }
  ]
}
